"id","rank","title","url","points","comments","scrape-date"
"44050222","1","Roto: A Compiled Scripting Language for Rust","https://blog.nlnetlabs.nl/introducing-roto-a-compiled-scripting-language-for-rust/","59","30","2025-05-21 14:04:17"
"44044043","2","Veo 3 and Imagen 4, and a new tool for filmmaking called Flow","https://blog.google/technology/ai/generative-media-models-io-2025/","703","418","2025-05-21 14:04:17"
"44051090","3","Building an agentic image generator that improves itself","https://simulate.trybezel.com/research/image_agent","20","5","2025-05-21 14:04:17"
"44048775","4","Overview of the Ada Computer Language Competition (1979)","https://iment.com/maida/computer/redref/","68","7","2025-05-21 14:04:17"
"44024834","5","Using unwrap() in Rust is Okay (2022)","https://burntsushi.net/unwrap/","43","39","2025-05-21 14:04:17"
"44044199","6","Gemma 3n preview: Mobile-first AI","https://developers.googleblog.com/en/introducing-gemma-3n/","373","129","2025-05-21 14:04:17"
"44048306","7","Convolutions, Polynomials and Flipped Kernels","https://eli.thegreenplace.net/2025/convolutions-polynomials-and-flipped-kernels/","80","14","2025-05-21 14:04:17"
"44046578","8","“ZLinq”, a Zero-Allocation LINQ Library for .NET","https://neuecc.medium.com/zlinq-a-zero-allocation-linq-library-for-net-1bb0a3e5c749","207","70","2025-05-21 14:04:17"
"44045292","9","Litestream: Revamped","https://fly.io/blog/litestream-revamped/","369","76","2025-05-21 14:04:17"
"44050521","10","Overlap (YC S24) Is Hiring","https://www.ycombinator.com/companies/overlap/jobs/Z8IbFjD-product-engineer","0","0","2025-05-21 14:04:17"
"44050437","11","Why Property Testing Finds Bugs Unit Testing Does Not (2021)","https://buttondown.com/hillelwayne/archive/why-property-testing-finds-bugs-unit-testing-does/","31","7","2025-05-21 14:04:17"
"44026703","12","What makes a good engineer also makes a good engineering organization (2024)","https://moxie.org/2024/09/23/a-good-engineer.html","231","86","2025-05-21 14:04:17"
"44015564","13","Withnail and I (2001)","https://www.criterion.com/current/posts/122-withnail-and-i","93","27","2025-05-21 14:04:17"
"44032680","14","Writing into Uninitialized Buffers in Rust","https://blog.sunfishcode.online/writingintouninitializedbuffersinrust/","96","76","2025-05-21 14:04:17"
"44041738","15","Deep Learning Is Applied Topology","https://theahura.substack.com/p/deep-learning-is-applied-topology","450","169","2025-05-21 14:04:17"
"44041255","16","Clojuring the web application stack: Meditation One","https://www.evalapply.org/posts/clojure-web-app-from-scratch/index.html","121","28","2025-05-21 14:04:17"
"44039808","17","AI's energy footprint","https://www.technologyreview.com/2025/05/20/1116327/ai-energy-usage-climate-footprint-big-tech/","236","262","2025-05-21 14:04:17"
"44044459","18","The NSA Selector","https://github.com/wenzellabs/the_NSA_selector","270","68","2025-05-21 14:04:17"
"44050152","19","Watching AI drive Microsoft employees insane","https://old.reddit.com/r/ExperiencedDevs/comments/1krttqo/my_new_hobby_watching_ai_slowly_drive_microsoft/","653","275","2025-05-21 14:04:17"
"44047693","20","A Secret Trove of Rare Guitars Heads to the Met","https://www.newyorker.com/magazine/2025/05/26/a-secret-trove-of-rare-guitars-heads-to-the-met","72","35","2025-05-21 14:04:17"
"44040407","21","Why does the U.S. always run a trade deficit?","https://libertystreeteconomics.newyorkfed.org/2025/05/why-does-the-u-s-always-run-a-trade-deficit/","270","631","2025-05-21 14:04:17"
"44023226","22","Building my own solar power system","https://medium.com/@joe_5312/pg-e-sucks-or-how-i-learned-to-stop-worrying-and-love-building-my-own-solar-system-acf0c9f03f3b","203","163","2025-05-21 14:04:17"
"44042371","23","Show HN: 90s.dev – Game maker that runs on the web","https://90s.dev/blog/finally-releasing-90s-dev.html","293","103","2025-05-21 14:04:17"
"44011686","24","My favourite fonts to use with LaTeX (2022)","https://www.lfe.pt/latex/fonts/typography/2022/11/21/latex-fonts-part1.html","153","43","2025-05-21 14:04:17"
"44051184","25","Coinbase says its data breach affects at least 69k customers","https://techcrunch.com/2025/05/21/coinbase-says-its-data-breach-affects-at-least-69000-customers/","9","8","2025-05-21 14:04:17"
"44042490","26","Show HN: A Tiling Window Manager for Windows, Written in Janet","https://agent-kilo.github.io/jwno/","262","89","2025-05-21 14:04:17"
"44044306","27","Red Programming Language","https://www.red-lang.org/p/about.html","175","104","2025-05-21 14:04:17"
"44013046","28","Life before the web – Running a Startup in the 1980's (2016)","https://blog.zamzar.com/2016/07/13/life-before-the-web-running-a-startup-in-the-1980s/","56","13","2025-05-21 14:04:17"
"44026959","29","Linguists find proof of sweeping language pattern once deemed a 'hoax'","https://www.scientificamerican.com/article/linguists-find-proof-of-sweeping-language-pattern-once-deemed-a-hoax/","112","116","2025-05-21 14:04:17"
"44021841","30","Taito-tastic: Kiki Kaikai and its Hardware","https://nicole.express/2025/pocky-but-wheres-rocky.html","39","3","2025-05-21 14:04:17"
