"id","rank","title","url","points","comments","scrape-date"
"44028153","1","Don't Guess My Language","https://vitonsky.net/blog/2025/05/17/language-detection/","35","11","2025-05-19 11:03:42"
"44027867","2","Show HN: Every side project I've built since 2009","https://naeemnur.com/side-projects/","41","5","2025-05-19 11:03:42"
"44026799","3","Show HN: Goboscript, text-based programming language, compiles to Scratch","https://github.com/aspizu/goboscript","105","27","2025-05-19 11:03:42"
"44020832","4","InventWood is about to mass-produce wood that's stronger than steel","https://techcrunch.com/2025/05/12/inventwood-is-about-to-mass-produce-wood-thats-stronger-than-steel/","124","121","2025-05-19 11:03:42"
"44027768","5","Emulator Debugging: Area 5150's Lake Effect","https://martypc.blogspot.com/2025/05/emulator-debugging-area-5150s-lake.html","17","2","2025-05-19 11:03:42"
"44027722","6","Seagate claims spinning disks beat SSDs on carbon footprint","https://blocksandfiles.com/2025/04/16/seagate-decarbonizing-data-report/","24","23","2025-05-19 11:03:42"
"43995067","7","New research reveals the strongest solar event ever detected, in 12350 BC","https://phys.org/news/2025-05-reveals-strongest-solar-event-bc.html","185","89","2025-05-19 11:03:42"
"44027379","8","What does the end of mathematics look like?","https://www.awanderingmind.blog/posts/2025-05-18-what-does-the-end-of-mathematics-look-like.html","31","34","2025-05-19 11:03:42"
"44020591","9","Spaced repetition systems have gotten better","https://domenic.me/fsrs/","891","464","2025-05-19 11:03:42"
"44025439","10","“There are people who can see and others who cannot even look”","https://worldhistory.substack.com/p/there-are-people-who-can-see-and","148","25","2025-05-19 11:03:42"
"44022448","11","Ditching Obsidian and building my own","https://amberwilliams.io/blogs/building-my-own-pkms","350","393","2025-05-19 11:03:42"
"44023634","12","Show HN: Sshsync – CLI tool to run shell commands across multiple remote servers","https://github.com/Blackmamoth/sshsync","20","26","2025-05-19 11:03:42"
"44022353","13","Show HN: I modeled the Voynich Manuscript with SBERT to test for structure","https://github.com/brianmg/voynich-nlp-analysis","342","102","2025-05-19 11:03:42"
"43993311","14","Llama from scratch (2023)","https://blog.briankitano.com/llama-from-scratch/","43","0","2025-05-19 11:03:42"
"44026170","15","Layers All the Way Down: The Untold Story of Shader Compilation","https://moonside.games/posts/layers-all-the-way-down/","67","29","2025-05-19 11:03:42"
"44024759","16","France Endorses UN Open Source Principles","https://social.numerique.gouv.fr/@codegouvfr/114529954373492878","481","145","2025-05-19 11:03:42"
"44010096","17","Font Activations: A Note on the Type","https://robhorning.substack.com/p/font-activations","38","1","2025-05-19 11:03:42"
"44025484","18","Show HN: Job board aggregator for best paying remote SWE jobs in the U.S.","https://www.remoteswe.fyi","69","48","2025-05-19 11:03:42"
"44022758","19","$30 Homebrew Automated Blinds Opener","https://sifter.org/~simon/journal/20240718.html","266","120","2025-05-19 11:03:42"
"44022225","20","Spaced Repetition Memory System","https://notes.andymatuschak.org/Spaced_repetition_memory_system","227","26","2025-05-19 11:03:42"
"44022215","21","What do wealthy people buy, that ordinary people know nothing about? (2015)","https://old.reddit.com/r/AskReddit/comments/2s9u0s/comment/cnnmca8/","199","335","2025-05-19 11:03:42"
"44012418","22","Programming in Martin-Lof's Type Theory: An Introduction (1990)","https://www.cse.chalmers.se/research/group/logic/book/","17","0","2025-05-19 11:03:42"
"44010684","23","The Connoisseur of Desire","https://www.nybooks.com/articles/2025/05/29/the-connoisseur-of-desire-the-annotated-great-gatsby/","24","0","2025-05-19 11:03:42"
"44023680","24","K-Scale Labs: Open-source humanoid robots, built for developers","https://www.kscale.dev/","102","46","2025-05-19 11:03:42"
"43998858","25","Charles Butler's the Feminine Monarchie, or the History of Bees (1634 Edition)","https://publicdomainreview.org/collection/history-of-bees/","3","0","2025-05-19 11:03:42"
"44005692","26","Show HN: A platform to find tech conferences, discounts, and ticket giveaways","https://www.tech.tickets/","78","21","2025-05-19 11:03:42"
"44024173","27","Hyper Typing","https://pscanf.com/s/341/","87","60","2025-05-19 11:03:42"
"43996422","28","Show HN: I reinvented PHP in TypeScript (demo)","https://github.com/vseplet/morph","8","6","2025-05-19 11:03:42"
"44023144","29","Show HN: Vaev – A browser engine built from scratch (It renders google.com)","https://github.com/skift-org/vaev","201","116","2025-05-19 11:03:42"
"44016037","30","Mystical","https://suberic.net/~dmm/projects/mystical/README.html","401","45","2025-05-19 11:03:42"
