"id","rank","title","url","points","comments","scrape-date"
"44026799","1","Show HN: Goboscript, text-based programming language, compiles to Scratch","https://github.com/aspizu/goboscript","18","4","2025-05-19 06:23:52"
"43995067","2","New research reveals the strongest solar event ever detected, in 12350 BC","https://phys.org/news/2025-05-reveals-strongest-solar-event-bc.html","137","67","2025-05-19 06:23:52"
"44026201","3","The principles of database design, or, the Truth is out there","https://ebellani.github.io/blog/2025/the-principles-of-database-design-or-the-truth-is-out-there/","40","26","2025-05-19 06:23:52"
"44025439","4","“There are people who can see and others who cannot even look”","https://worldhistory.substack.com/p/there-are-people-who-can-see-and","98","14","2025-05-19 06:23:52"
"44020591","5","Spaced repetition systems have gotten better","https://domenic.me/fsrs/","807","440","2025-05-19 06:23:52"
"44022448","6","Ditching Obsidian and building my own","https://amberwilliams.io/blogs/building-my-own-pkms","302","318","2025-05-19 06:23:52"
"44026170","7","Layers All the Way Down: The Untold Story of Shader Compilation","https://moonside.games/posts/layers-all-the-way-down/","26","7","2025-05-19 06:23:52"
"44010096","8","Font Activations: A Note on the Type","https://robhorning.substack.com/p/font-activations","24","0","2025-05-19 06:23:52"
"44022353","9","Show HN: I modeled the Voynich Manuscript with SBERT to test for structure","https://github.com/brianmg/voynich-nlp-analysis","315","97","2025-05-19 06:23:52"
"44024759","10","France Endorses UN Open Source Principles","https://social.numerique.gouv.fr/@codegouvfr/114529954373492878","364","82","2025-05-19 06:23:52"
"44022758","11","$30 Homebrew Automated Blinds Opener","https://sifter.org/~simon/journal/20240718.html","237","96","2025-05-19 06:23:52"
"44026414","12","The lack of a good command line way to sort IPv6 addresses","https://utcc.utoronto.ca/~cks/space/blog/unix/SortingIPv6Addresses","12","8","2025-05-19 06:23:52"
"44023144","13","Show HN: Vaev – A browser engine built from scratch (It renders google.com)","https://github.com/skift-org/vaev","169","81","2025-05-19 06:23:52"
"44025484","14","Show HN: Job board aggregator for best paying remote SWE jobs in the U.S.","https://www.remoteswe.fyi","28","15","2025-05-19 06:23:52"
"44010684","15","The Connoisseur of Desire","https://www.nybooks.com/articles/2025/05/29/the-connoisseur-of-desire-the-annotated-great-gatsby/","15","0","2025-05-19 06:23:52"
"44022225","16","Spaced Repetition Memory System","https://notes.andymatuschak.org/Spaced_repetition_memory_system","206","19","2025-05-19 06:23:52"
"44005692","17","Show HN: A platform to find tech conferences, discounts, and ticket giveaways","https://www.tech.tickets/","61","18","2025-05-19 06:23:52"
"43996770","18","The Tongue Is a Fire","https://www.lrb.co.uk/the-paper/v47/n09/ferdinand-mount/the-tongue-is-a-fire","16","4","2025-05-19 06:23:52"
"44024173","19","Hyper Typing","https://pscanf.com/s/341/","72","55","2025-05-19 06:23:52"
"44023680","20","K-Scale Labs: Open-source humanoid robots, built for developers","https://www.kscale.dev/","80","41","2025-05-19 06:23:52"
"43993311","21","Llama from scratch (or how to implement a paper without crying)","https://blog.briankitano.com/llama-from-scratch/","3","0","2025-05-19 06:23:52"
"44009185","22","Comparing Parallel Functional Array Languages: Programming and Performance","https://arxiv.org/abs/2505.08906","65","11","2025-05-19 06:23:52"
"44024055","23","Show HN: Python Simulator of David Deutsch’s “Constructor Theory of Time”","https://github.com/gvelesandro/constructor-theory-simulator","65","7","2025-05-19 06:23:52"
"44023423","24","The Fall of Roam (2022)","https://every.to/superorganizers/the-fall-of-roam","110","58","2025-05-19 06:23:52"
"44012538","25","Publisher: The Malloy Semantic Model Server","https://github.com/malloydata/publisher","15","0","2025-05-19 06:23:52"
"44022215","26","What do wealthy people buy, that ordinary people know nothing about? (2015)","https://old.reddit.com/r/AskReddit/comments/2s9u0s/comment/cnnmca8/","114","156","2025-05-19 06:23:52"
"43999897","27","In Memoriam: John L. Young, Cryptome Co-Founder","https://www.eff.org/deeplinks/2025/05/memoriam-john-l-young-cryptome-co-founder","191","23","2025-05-19 06:23:52"
"44016037","28","Mystical","https://suberic.net/~dmm/projects/mystical/README.html","386","44","2025-05-19 06:23:52"
"44022265","29","Show HN: Buckaroo – Data table UI for Notebooks","https://github.com/paddymul/buckaroo","92","8","2025-05-19 06:23:52"
"44022484","30","Emergent social conventions and collective bias in LLM populations","https://www.science.org/doi/10.1126/sciadv.adu9368","58","18","2025-05-19 06:23:52"
