"id","rank","title","url","points","comments","scrape-date"
"44023226","1","Building my own solar power system","https://medium.com/@joe_5312/pg-e-sucks-or-how-i-learned-to-stop-worrying-and-love-building-my-own-solar-system-acf0c9f03f3b","218","178","2025-05-21 14:37:36"
"44050222","2","Roto: A Compiled Scripting Language for Rust","https://blog.nlnetlabs.nl/introducing-roto-a-compiled-scripting-language-for-rust/","83","59","2025-05-21 14:37:36"
"44044043","3","Veo 3 and Imagen 4, and a new tool for filmmaking called Flow","https://blog.google/technology/ai/generative-media-models-io-2025/","713","427","2025-05-21 14:37:36"
"44048775","4","Overview of the Ada Computer Language Competition (1979)","https://iment.com/maida/computer/redref/","73","7","2025-05-21 14:37:36"
"44051090","5","Building an agentic image generator that improves itself","https://simulate.trybezel.com/research/image_agent","29","5","2025-05-21 14:37:36"
"44044199","6","Gemma 3n preview: Mobile-first AI","https://developers.googleblog.com/en/introducing-gemma-3n/","377","132","2025-05-21 14:37:36"
"44048306","7","Convolutions, Polynomials and Flipped Kernels","https://eli.thegreenplace.net/2025/convolutions-polynomials-and-flipped-kernels/","82","18","2025-05-21 14:37:36"
"44050521","8","Overlap (YC S24) Is Hiring","https://www.ycombinator.com/companies/overlap/jobs/Z8IbFjD-product-engineer","0","0","2025-05-21 14:37:36"
"44046578","9","“ZLinq”, a Zero-Allocation LINQ Library for .NET","https://neuecc.medium.com/zlinq-a-zero-allocation-linq-library-for-net-1bb0a3e5c749","215","71","2025-05-21 14:37:36"
"44045292","10","Litestream: Revamped","https://fly.io/blog/litestream-revamped/","375","77","2025-05-21 14:37:36"
"44050437","11","Why Property Testing Finds Bugs Unit Testing Does Not (2021)","https://buttondown.com/hillelwayne/archive/why-property-testing-finds-bugs-unit-testing-does/","39","17","2025-05-21 14:37:36"
"44019374","12","Show HN: Keep track of why you muted someone on X","https://github.com/klntsky/x-user-note","11","5","2025-05-21 14:37:36"
"44026703","13","What makes a good engineer also makes a good engineering organization (2024)","https://moxie.org/2024/09/23/a-good-engineer.html","242","88","2025-05-21 14:37:36"
"44015564","14","Withnail and I (2001)","https://www.criterion.com/current/posts/122-withnail-and-i","98","33","2025-05-21 14:37:36"
"44032680","15","Writing into Uninitialized Buffers in Rust","https://blog.sunfishcode.online/writingintouninitializedbuffersinrust/","100","79","2025-05-21 14:37:36"
"44041738","16","Deep Learning Is Applied Topology","https://theahura.substack.com/p/deep-learning-is-applied-topology","454","172","2025-05-21 14:37:36"
"44039808","17","AI's energy footprint","https://www.technologyreview.com/2025/05/20/1116327/ai-energy-usage-climate-footprint-big-tech/","242","269","2025-05-21 14:37:36"
"44041255","18","Clojuring the web application stack: Meditation One","https://www.evalapply.org/posts/clojure-web-app-from-scratch/index.html","125","29","2025-05-21 14:37:36"
"44044459","19","The NSA Selector","https://github.com/wenzellabs/the_NSA_selector","272","68","2025-05-21 14:37:36"
"44042371","20","Show HN: 90s.dev – Game maker that runs on the web","https://90s.dev/blog/finally-releasing-90s-dev.html","304","107","2025-05-21 14:37:36"
"44040407","21","Why does the U.S. always run a trade deficit?","https://libertystreeteconomics.newyorkfed.org/2025/05/why-does-the-u-s-always-run-a-trade-deficit/","272","640","2025-05-21 14:37:36"
"44050152","22","Watching AI drive Microsoft employees insane","https://old.reddit.com/r/ExperiencedDevs/comments/1krttqo/my_new_hobby_watching_ai_slowly_drive_microsoft/","705","319","2025-05-21 14:37:36"
"44011686","23","My favourite fonts to use with LaTeX (2022)","https://www.lfe.pt/latex/fonts/typography/2022/11/21/latex-fonts-part1.html","154","47","2025-05-21 14:37:36"
"44043687","24","The Dawn of Nvidia's Technology","https://blog.dshr.org/2025/05/the-dawn-of-nvidias-technology.html","166","64","2025-05-21 14:37:36"
"44042490","25","Show HN: A Tiling Window Manager for Windows, Written in Janet","https://agent-kilo.github.io/jwno/","262","90","2025-05-21 14:37:36"
"44051162","26","We Should Let a Lottery Decide Our Government (2019)","https://thewalrus.ca/why-we-should-let-a-lottery-decide-our-government/","18","7","2025-05-21 14:37:36"
"44044306","27","Red Programming Language","https://www.red-lang.org/p/about.html","178","107","2025-05-21 14:37:36"
"44026959","28","Linguists find proof of sweeping language pattern once deemed a 'hoax'","https://www.scientificamerican.com/article/linguists-find-proof-of-sweeping-language-pattern-once-deemed-a-hoax/","114","121","2025-05-21 14:37:36"
"44021841","29","Taito-tastic: Kiki Kaikai and its Hardware","https://nicole.express/2025/pocky-but-wheres-rocky.html","40","3","2025-05-21 14:37:36"
"44042070","30","OpenAI Codex hands-on review","https://zackproser.com/blog/openai-codex-review","145","105","2025-05-21 14:37:36"
