"id","rank","title","url","points","comments","scrape-date"
"44050222","1","Roto: A Compiled Scripting Language for Rust","https://blog.nlnetlabs.nl/introducing-roto-a-compiled-scripting-language-for-rust/","9","3","2025-05-21 13:03:27"
"44044043","2","Veo 3 and Imagen 4, and a new tool for filmmaking called Flow","https://blog.google/technology/ai/generative-media-models-io-2025/","680","405","2025-05-21 13:03:27"
"44048775","3","Overview of the Ada Computer Language Competition (1979)","https://iment.com/maida/computer/redref/","63","7","2025-05-21 13:03:27"
"44048306","4","Convolutions, Polynomials and Flipped Kernels","https://eli.thegreenplace.net/2025/convolutions-polynomials-and-flipped-kernels/","74","7","2025-05-21 13:03:27"
"44024834","5","Using unwrap() in Rust is Okay (2022)","https://burntsushi.net/unwrap/","32","19","2025-05-21 13:03:27"
"44044199","6","Gemma 3n preview: Mobile-first AI","https://developers.googleblog.com/en/introducing-gemma-3n/","362","125","2025-05-21 13:03:27"
"44046578","7","“ZLinq”, a Zero-Allocation LINQ Library for .NET","https://neuecc.medium.com/zlinq-a-zero-allocation-linq-library-for-net-1bb0a3e5c749","200","64","2025-05-21 13:03:27"
"44050521","8","Overlap (YC S24) Is Hiring","https://www.ycombinator.com/companies/overlap/jobs/Z8IbFjD-product-engineer","0","0","2025-05-21 13:03:27"
"44015564","9","Withnail and I (2001)","https://www.criterion.com/current/posts/122-withnail-and-i","74","23","2025-05-21 13:03:27"
"44045292","10","Litestream: Revamped","https://fly.io/blog/litestream-revamped/","354","76","2025-05-21 13:03:27"
"44041255","11","Clojuring the web application stack: Meditation One","https://www.evalapply.org/posts/clojure-web-app-from-scratch/index.html","117","28","2025-05-21 13:03:27"
"44026703","12","What makes a good engineer also makes a good engineering organization (2024)","https://moxie.org/2024/09/23/a-good-engineer.html","219","77","2025-05-21 13:03:27"
"44050437","13","Why Property Testing Finds Bugs Unit Testing Does Not (2021)","https://buttondown.com/hillelwayne/archive/why-property-testing-finds-bugs-unit-testing-does/","13","1","2025-05-21 13:03:27"
"44032680","14","Writing into Uninitialized Buffers in Rust","https://blog.sunfishcode.online/writingintouninitializedbuffersinrust/","91","76","2025-05-21 13:03:27"
"44023226","15","Building my own solar power system","https://medium.com/@joe_5312/pg-e-sucks-or-how-i-learned-to-stop-worrying-and-love-building-my-own-solar-system-acf0c9f03f3b","186","142","2025-05-21 13:03:27"
"44050152","16","My new hobby: watching AI slowly drive Microsoft employees insane","https://old.reddit.com/r/ExperiencedDevs/comments/1krttqo/my_new_hobby_watching_ai_slowly_drive_microsoft/","546","215","2025-05-21 13:03:27"
"44041738","17","Deep Learning Is Applied Topology","https://theahura.substack.com/p/deep-learning-is-applied-topology","445","169","2025-05-21 13:03:27"
"44044459","18","The NSA Selector","https://github.com/wenzellabs/the_NSA_selector","266","68","2025-05-21 13:03:27"
"44048518","19","Show HN: Kraa.io – Markdown editor for notes, blogs, chats","https://kraa.io","45","20","2025-05-21 13:03:27"
"44023081","20","Someone got an LLM running on a Commodore 64 from 1982, and it runs as well","https://www.xda-developers.com/llm-running-commodore-64/","31","8","2025-05-21 13:03:27"
"44039808","21","AI's energy footprint","https://www.technologyreview.com/2025/05/20/1116327/ai-energy-usage-climate-footprint-big-tech/","224","240","2025-05-21 13:03:27"
"44042371","22","Show HN: 90s.dev – Game maker that runs on the web","https://90s.dev/blog/finally-releasing-90s-dev.html","290","101","2025-05-21 13:03:27"
"44040407","23","Why does the U.S. always run a trade deficit?","https://libertystreeteconomics.newyorkfed.org/2025/05/why-does-the-u-s-always-run-a-trade-deficit/","259","615","2025-05-21 13:03:27"
"44011686","24","My favourite fonts to use with LaTeX (2022)","https://www.lfe.pt/latex/fonts/typography/2022/11/21/latex-fonts-part1.html","147","43","2025-05-21 13:03:27"
"44047693","25","A Secret Trove of Rare Guitars Heads to the Met","https://www.newyorker.com/magazine/2025/05/26/a-secret-trove-of-rare-guitars-heads-to-the-met","67","29","2025-05-21 13:03:27"
"44044306","26","Red Programming Language","https://www.red-lang.org/p/about.html","171","92","2025-05-21 13:03:27"
"44026456","27","Capalyze – Natural language data analysis","https://capalyze.ai/home","6","3","2025-05-21 13:03:27"
"44042490","28","Show HN: A Tiling Window Manager for Windows, Written in Janet","https://agent-kilo.github.io/jwno/","254","88","2025-05-21 13:03:27"
"44021841","29","Taito-tastic: Kiki Kaikai and its Hardware","https://nicole.express/2025/pocky-but-wheres-rocky.html","37","3","2025-05-21 13:03:27"
"44013046","30","Life before the web – Running a Startup in the 1980's (2016)","https://blog.zamzar.com/2016/07/13/life-before-the-web-running-a-startup-in-the-1980s/","49","10","2025-05-21 13:03:27"
