"id","rank","title","url","points","comments","scrape-date"
"44026799","1","Show HN: Goboscript, text-based programming language, compiles to Scratch","https://github.com/aspizu/goboscript","68","16","2025-05-19 08:23:56"
"44020832","2","InventWood is about to mass-produce wood that's stronger than steel","https://techcrunch.com/2025/05/12/inventwood-is-about-to-mass-produce-wood-thats-stronger-than-steel/","53","32","2025-05-19 08:23:56"
"44023634","3","Show HN: Sshsync – CLI tool to run shell commands across multiple remote servers","https://github.com/Blackmamoth/sshsync","16","4","2025-05-19 08:23:56"
"43995067","4","New research reveals the strongest solar event ever detected, in 12350 BC","https://phys.org/news/2025-05-reveals-strongest-solar-event-bc.html","166","79","2025-05-19 08:23:56"
"44012283","5","`This Printer company served you malware for months, called them false positives","https://www.neowin.net/news/this-printer-company-served-you-malware-for-months-and-dismissed-it-as-false-positives/","36","6","2025-05-19 08:23:56"
"44020591","6","Spaced repetition systems have gotten better","https://domenic.me/fsrs/","851","452","2025-05-19 08:23:56"
"44025439","7","“There are people who can see and others who cannot even look”","https://worldhistory.substack.com/p/there-are-people-who-can-see-and","122","20","2025-05-19 08:23:56"
"44022448","8","Ditching Obsidian and building my own","https://amberwilliams.io/blogs/building-my-own-pkms","329","353","2025-05-19 08:23:56"
"44026170","9","Layers All the Way Down: The Untold Story of Shader Compilation","https://moonside.games/posts/layers-all-the-way-down/","51","18","2025-05-19 08:23:56"
"44022353","10","Show HN: I modeled the Voynich Manuscript with SBERT to test for structure","https://github.com/brianmg/voynich-nlp-analysis","331","101","2025-05-19 08:23:56"
"44010096","11","Font Activations: A Note on the Type","https://robhorning.substack.com/p/font-activations","29","0","2025-05-19 08:23:56"
"44024759","12","France Endorses UN Open Source Principles","https://social.numerique.gouv.fr/@codegouvfr/114529954373492878","427","106","2025-05-19 08:23:56"
"43993311","13","Llama from scratch (2023)","https://blog.briankitano.com/llama-from-scratch/","23","0","2025-05-19 08:23:56"
"44025484","14","Show HN: Job board aggregator for best paying remote SWE jobs in the U.S.","https://www.remoteswe.fyi","49","37","2025-05-19 08:23:56"
"44022758","15","$30 Homebrew Automated Blinds Opener","https://sifter.org/~simon/journal/20240718.html","252","113","2025-05-19 08:23:56"
"44010684","16","The Connoisseur of Desire","https://www.nybooks.com/articles/2025/05/29/the-connoisseur-of-desire-the-annotated-great-gatsby/","19","0","2025-05-19 08:23:56"
"44022225","17","Spaced Repetition Memory System","https://notes.andymatuschak.org/Spaced_repetition_memory_system","217","25","2025-05-19 08:23:56"
"44026201","18","The principles of database design, or, the Truth is out there","https://ebellani.github.io/blog/2025/the-principles-of-database-design-or-the-truth-is-out-there/","56","49","2025-05-19 08:23:56"
"43996422","19","Show HN: I reinvented PHP in TypeScript (demo)","https://github.com/vseplet/morph","3","1","2025-05-19 08:23:56"
"44023680","20","K-Scale Labs: Open-source humanoid robots, built for developers","https://www.kscale.dev/","94","42","2025-05-19 08:23:56"
"44024173","21","Hyper Typing","https://pscanf.com/s/341/","81","55","2025-05-19 08:23:56"
"44022215","22","What do wealthy people buy, that ordinary people know nothing about? (2015)","https://old.reddit.com/r/AskReddit/comments/2s9u0s/comment/cnnmca8/","151","234","2025-05-19 08:23:56"
"44023144","23","Show HN: Vaev – A browser engine built from scratch (It renders google.com)","https://github.com/skift-org/vaev","183","104","2025-05-19 08:23:56"
"44005692","24","Show HN: A platform to find tech conferences, discounts, and ticket giveaways","https://www.tech.tickets/","71","21","2025-05-19 08:23:56"
"44009185","25","Comparing Parallel Functional Array Languages: Programming and Performance","https://arxiv.org/abs/2505.08906","74","12","2025-05-19 08:23:56"
"44024055","26","Show HN: Python Simulator of David Deutsch’s “Constructor Theory of Time”","https://github.com/gvelesandro/constructor-theory-simulator","68","7","2025-05-19 08:23:56"
"44023423","27","The Fall of Roam (2022)","https://every.to/superorganizers/the-fall-of-roam","113","62","2025-05-19 08:23:56"
"43996770","28","The Tongue Is a Fire","https://www.lrb.co.uk/the-paper/v47/n09/ferdinand-mount/the-tongue-is-a-fire","19","7","2025-05-19 08:23:56"
"44016037","29","Mystical","https://suberic.net/~dmm/projects/mystical/README.html","393","44","2025-05-19 08:23:56"
"43999897","30","In Memoriam: John L. Young, Cryptome Co-Founder","https://www.eff.org/deeplinks/2025/05/memoriam-john-l-young-cryptome-co-founder","199","24","2025-05-19 08:23:56"
