"id","rank","title","url","points","comments","scrape-date"
"47712340","1","Microsoft PhotoDNA scanning problem","https://www.elevenforum.com/t/microsoft-photodna-scanning-problem-it-is-comical-now.45961/","52","19","2026-04-10 02:07:43"
"47708818","2","Native Instant Space Switching on macOS","https://arhan.sh/blog/native-instant-space-switching-on-macos/","319","154","2026-04-10 02:07:43"
"47704804","3","How NASA Built Artemis II’s Fault-Tolerant Computer","https://cacm.acm.org/news/how-nasa-built-artemis-iis-fault-tolerant-computer/","84","28","2026-04-10 02:07:43"
"47709158","4","Charcuterie – Visual similarity Unicode explorer","https://charcuterie.elastiq.ch/","126","19","2026-04-10 02:07:43"
"47708041","5","PicoZ80 – Drop-In Z80 Replacement","https://eaw.app/picoz80/","150","22","2026-04-10 02:07:43"
"47709130","6","Reverse engineering Gemini's SynthID detection","https://github.com/aloshdenny/reverse-SynthID","114","43","2026-04-10 02:07:43"
"47660911","7","Will I ever own a zettaflop?","https://geohot.github.io//blog/jekyll/update/2026/01/26/own-a-zettaflop.html","48","23","2026-04-10 02:07:43"
"47670188","8","Robots Eat Cars","https://telemetry.endeff.com/p/robots-eat-cars","44","32","2026-04-10 02:07:43"
"47675906","9","Generative Art over the Years","https://blog.veitheller.de/Generative_art_over_the_years.html","5","0","2026-04-10 02:07:43"
"47706140","10","Unfolder for Mac – A 3D model unfolding tool for creating papercraft","https://www.unfolder.app/","149","33","2026-04-10 02:07:43"
"47710907","11","Many African families spend fortunes burying their dead","https://davidoks.blog/p/how-funerals-keep-africa-poor","135","107","2026-04-10 02:07:43"
"47710007","12","Moving from WordPress to Jekyll (and static site generators in general)","https://www.demandsphere.com/blog/rebuilding-demandsphere-with-jekyll-and-claude-code/","42","17","2026-04-10 02:07:43"
"47707477","13","Old laptops in a colo as low cost servers","https://colaptop.pages.dev/","155","86","2026-04-10 02:07:43"
"47707762","14","Hegel, a universal property-based testing protocol and family of PBT libraries","https://hegel.dev","84","30","2026-04-10 02:07:43"
"47706141","15","Research-Driven Agents: When an agent reads before it codes","https://blog.skypilot.co/research-driven-agents/","131","43","2026-04-10 02:07:43"
"47701148","16","Top laptops to use with FreeBSD","https://freebsdfoundation.github.io/freebsd-laptop-testing/","282","162","2026-04-10 02:07:43"
"47710845","17","BunnyCDN has been silently losing our production files for 15 months","https://old.reddit.com/r/webdev/comments/1sglytg/bunnycdn_has_been_silently_losing_our_production/","119","26","2026-04-10 02:07:43"
"47700972","18","Reallocating $100/Month Claude Code Spend to Zed and OpenRouter","https://braw.dev/blog/2026-04-06-reallocating-100-month-claude-spend/","296","204","2026-04-10 02:07:43"
"47651764","19","How Close Is Too Close? Applying Fluid Dynamics Research Methods to PC Cooling","https://www.lttlabs.com/articles/2026/04/04/how-close-is-too-close-applying-fundamental-fluid-dynamics-research-methods-to-pc-cooling","10","2","2026-04-10 02:07:43"
"47710149","20","Microsoft is employing dark patterns to goad users into paying for storage?","https://lzon.ca/posts/other/microsoft-user-abuse/","221","121","2026-04-10 02:07:43"
"47705413","21","Show HN: I built a Cargo-like build tool for C/C++","https://github.com/randerson112/craft","118","110","2026-04-10 02:07:43"
"47685644","22","Introduction to Nintendo DS Programming","https://www.patater.com/files/projects/manual/manual.html","218","50","2026-04-10 02:07:43"
"47702541","23","A WebGPU implementation of Augmented Vertex Block Descent","https://github.com/jure/webphysics","124","15","2026-04-10 02:07:43"
"47710782","24","The Training Example Lie Bracket","https://pbement.com/posts/lie_brackets/","13","9","2026-04-10 02:07:43"
"47706268","25","EFF is leaving X","https://www.eff.org/deeplinks/2026/04/eff-leaving-x","1120","942","2026-04-10 02:07:43"
"47701572","26","Wit, unker, Git: The lost medieval pronouns of English intimacy","https://www.bbc.com/future/article/20260408-the-extinct-english-words-for-just-the-two-of-us","187","120","2026-04-10 02:07:43"
"47695666","27","Show HN: Druids – Build your own software factory","https://github.com/fulcrumresearch/druids","25","3","2026-04-10 02:07:43"
"47711960","28","Vibe-Coded Ext4 for OpenBSD","https://lwn.net/Articles/1064541/","5","4","2026-04-10 02:07:43"
"47707632","29","Instant 1.0, a backend for AI-coded apps","https://www.instantdb.com/essays/architecture","92","57","2026-04-10 02:07:43"
"47711964","30","Sam Altman's Coworkers Say He Can Barely Code and Misunderstands Basic Concepts","https://futurism.com/artificial-intelligence/sam-altman-technical-coding","25","12","2026-04-10 02:07:43"
