"id","rank","title","url","points","comments","scrape-date"
"44071900","1","Remembering Alasdair MacIntyre (1929-2025)","https://www.wordonfire.org/articles/remembering-alasdair-macintyre-1929-2025/","39","12","2025-05-23 13:24:36"
"44070042","2","John Carmack talk at Upper Bound 2025","https://twitter.com/ID_AA_Carmack/status/1925710474366034326","277","144","2025-05-23 13:24:36"
"44050465","3","The Curious Case of the Pygmy Nuthatch","https://slate.com/culture/2025/05/birds-movies-charlies-angels-2000-pygmy-nuthatch.html","30","4","2025-05-23 13:24:36"
"44070532","4","KumoRFM: A Foundation Model for In-Context Learning on Relational Data","https://kumo.ai/company/news/kumo-relational-foundation-model/","57","9","2025-05-23 13:24:36"
"44049926","5","Satellites Spotting Depth","https://tech.marksblogg.com/depth-anything-v2-maxar-ai-detection.html","43","4","2025-05-23 13:24:36"
"44045617","6","Quantum Picturalism","https://quantuminpictures.org/","20","0","2025-05-23 13:24:36"
"44067409","7","Show HN: Defuddle, an HTML-to-Markdown alternative to Readability","https://github.com/kepano/defuddle","306","52","2025-05-23 13:24:36"
"44031082","8","'Turbocharged' Mitochondria Power Birds' Epic Migratory Journeys","https://www.quantamagazine.org/turbocharged-mitochondria-power-birds-epic-migratory-journeys-20250519/","26","9","2025-05-23 13:24:36"
"44063248","9","That fractal that's been up on my wall for years","https://chriskw.xyz/2025/05/21/Fractal/","476","34","2025-05-23 13:24:36"
"44063703","10","Claude 4","https://www.anthropic.com/news/claude-4","1817","1039","2025-05-23 13:24:36"
"44065458","11","Does Earth have two high-tide bulges on opposite sides? (2014)","http://physics.stackexchange.com/questions/121830/does-earth-really-have-two-high-tide-bulges-on-opposite-sides","234","71","2025-05-23 13:24:36"
"44063662","12","Mozilla to shut down Pocket and Fakespot","https://support.mozilla.org/en-US/kb/future-of-pocket","1018","635","2025-05-23 13:24:36"
"44036208","13","A Formal Mathematical Investigation on the Validity of Kellogg's Glaze Claims","https://old.reddit.com/r/theydidthemath/comments/1iljmig/_/","44","8","2025-05-23 13:24:36"
"44068197","14","32 bits that changed microprocessor design","https://spectrum.ieee.org/bellmac-32-ieee-milestone","103","29","2025-05-23 13:24:36"
"44071418","15","OpenAI: Scaling PostgreSQL to the Next Level","https://www.pixelstech.net/article/1747708863-openai%3a-scaling-postgresql-to-the-next-level","86","34","2025-05-23 13:24:36"
"44071610","16","Writing A Job Runner (In Elixir) (Again) (10 years later)","https://github.com/notactuallytreyanastasio/genstage_tutorial_2025/blob/main/README.md","5","1","2025-05-23 13:24:36"
"44068204","17","Sketchy Calendar","https://www.inkandswitch.com/ink/notes/sketchy-calendar/","102","25","2025-05-23 13:24:36"
"44062160","18","Fast Allocations in Ruby 3.5","https://railsatscale.com/2025-05-21-fast-allocations-in-ruby-3-5/","234","58","2025-05-23 13:24:36"
"44027471","19","Tallest Wooden Wind Turbine","https://modvion.com/","87","71","2025-05-23 13:24:36"
"44065094","20","How to cheat at settlers by loading the dice (2017)","https://izbicki.me/blog/how-to-cheat-at-settlers-of-catan-by-loading-the-dice-and-prove-it-with-p-values.html","122","101","2025-05-23 13:24:36"
"44061160","21","Improving performance of rav1d video decoder","https://ohadravid.github.io/posts/2025-05-rav1d-faster/","281","97","2025-05-23 13:24:36"
"44050269","22","A South Korean grand master on the art of the perfect soy sauce","https://www.theguardian.com/world/2025/may/21/without-time-there-is-no-flavour-a-south-korean-grand-master-on-the-art-of-the-perfect-soy-sauce","181","142","2025-05-23 13:24:36"
"44064230","23","We’ll be ending web hosting for your apps on Glitch","https://blog.glitch.com/post/changes-are-coming-to-glitch/","138","86","2025-05-23 13:24:36"
"44060156","24","Ancient law requires a bale of straw to hang from Charing Cross rail bridge","https://www.ianvisits.co.uk/articles/ancient-law-requires-a-bale-of-hay-to-hang-from-charing-cross-rail-bridge-81318/","100","115","2025-05-23 13:24:36"
"44062227","25","I Built My Own Audio Player","https://nexo.sh/posts/why-i-built-a-native-mp3-player-in-swiftui/","237","141","2025-05-23 13:24:36"
"44033606","26","Richard Garwin’s role in designing the hydrogen bomb was obscured","https://www.nytimes.com/2025/05/19/science/richard-garwin-hydrogen-bomb.html","62","24","2025-05-23 13:24:36"
"44072110","27","A 2030 Morning Routine","https://www.marginalia.nu/log/a_120_morning_routine_2030/","45","17","2025-05-23 13:24:36"
"44026516","28","When a team is too big","https://blog.alexewerlof.com/p/when-a-team-is-too-big","98","100","2025-05-23 13:24:36"
"44061836","29","Show HN: SQLite JavaScript - extend your database with JavaScript","https://github.com/sqliteai/sqlite-js","177","51","2025-05-23 13:24:36"
"44063000","30","Launch HN: WorkDone (YC X25) – AI Audit of Medical Charts","https://news.ycombinator.com/item?id=44063000","68","53","2025-05-23 13:24:36"
