"id","rank","title","url","points","comments","scrape-date"
"44063703","1","Claude 4","https://www.anthropic.com/news/claude-4","1231","606","2025-05-22 22:04:00"
"44063662","2","Mozilla to shut down Pocket on July 8","https://support.mozilla.org/en-US/kb/future-of-pocket","642","415","2025-05-22 22:04:00"
"44063248","3","That fractal that's been up on my wall for 12 years","https://chriskw.xyz/2025/05/21/Fractal/","223","18","2025-05-22 22:04:00"
"44067409","4","Show HN: Defuddle, an HTML-to-Markdown alternative to Readability","https://github.com/kepano/defuddle","10","4","2025-05-22 22:04:00"
"44065458","5","Does Earth have two high-tide bulges on opposite sides? (2014)","http://physics.stackexchange.com/questions/121830/does-earth-really-have-two-high-tide-bulges-on-opposite-sides","79","24","2025-05-22 22:04:00"
"44065094","6","How to cheat at settlers by loading the dice (2017)","https://izbicki.me/blog/how-to-cheat-at-settlers-of-catan-by-loading-the-dice-and-prove-it-with-p-values.html","60","44","2025-05-22 22:04:00"
"44064631","7","Trump administration halts Harvard's ability to enroll international students","https://www.nytimes.com/2025/05/22/us/politics/trump-harvard-international-students.html","433","379","2025-05-22 22:04:00"
"44064875","8","Loading Pydantic models from JSON without running out of memory","https://pythonspeed.com/articles/pydantic-json-memory/","57","16","2025-05-22 22:04:00"
"44066713","9","Trade Secrecy in Willy Wonka's Chocolate Factory (2009)","https://papers.ssrn.com/sol3/papers.cfm?abstract_id=1430463","12","1","2025-05-22 22:04:00"
"44061160","10","Improving performance of rav1d video decoder","https://ohadravid.github.io/posts/2025-05-rav1d-faster/","238","78","2025-05-22 22:04:00"
"44062160","11","Fast Allocations in Ruby 3.5","https://railsatscale.com/2025-05-21-fast-allocations-in-ruby-3-5/","151","42","2025-05-22 22:04:00"
"44063000","12","Launch HN: WorkDone (YC X25) – AI Audit of Medical Charts","https://news.ycombinator.com/item?id=44063000","48","45","2025-05-22 22:04:00"
"44050269","13","A South Korean grand master on the art of the perfect soy sauce","https://www.theguardian.com/world/2025/may/21/without-time-there-is-no-flavour-a-south-korean-grand-master-on-the-art-of-the-perfect-soy-sauce","102","59","2025-05-22 22:04:00"
"44066696","14","The Annotated Kolmogorov-Arnold Network (Kan)","https://alexzhang13.github.io/blog/2024/annotated-kan/","10","1","2025-05-22 22:04:00"
"44027395","15","Show HN: Hsdlib – A C Library for Vector Similarity with SIMD Acceleration","https://news.ycombinator.com/item?id=44027395","7","0","2025-05-22 22:04:00"
"44065775","16","Problems in AI alignment: A scale model","https://muldoon.cloud/2025/05/22/alignment.html","14","1","2025-05-22 22:04:00"
"44027229","17","When good pseudorandom numbers go bad","https://blog.djnavarro.net/posts/2025-05-18_multivariate-normal-sampling-floating-point/","13","0","2025-05-22 22:04:00"
"44061836","18","Show HN: SQLite JavaScript - extend your database with JavaScript","https://github.com/sqliteai/sqlite-js","129","38","2025-05-22 22:04:00"
"44062227","19","I Built My Own Audio Player","https://nexo.sh/posts/why-i-built-a-native-mp3-player-in-swiftui/","134","69","2025-05-22 22:04:00"
"44060305","20","Planetfall","https://somethingaboutmaps.wordpress.com/2025/05/20/planetfall/","285","73","2025-05-22 22:04:00"
"44065146","21","Practicing graphical debugging using visualizations of the Hilbert curve","https://akkartik.name/debugUIs.html","18","0","2025-05-22 22:04:00"
"44030263","22","Research Uncovers Parthenon Spectacular Lighting Effects for Athena in Antiquity","https://arkeonews.net/research-uncovers-the-parthenons-spectacular-lighting-effects-for-athena-in-antiquity/","17","0","2025-05-22 22:04:00"
"44064230","23","We’ll be ending web hosting for your apps on Glitch","https://blog.glitch.com/post/changes-are-coming-to-glitch/","45","30","2025-05-22 22:04:00"
"44066237","24","Async from scratch 3: Pinned against the wall","https://natkr.com/2025-05-22-async-from-scratch-3/","10","0","2025-05-22 22:04:00"
"44062130","25","Adventures in Symbolic Algebra with Model Context Protocol","https://www.stephendiehl.com/posts/computer_algebra_mcp/","76","19","2025-05-22 22:04:00"
"44063051","26","Near-infrared spatiotemporal color vision enabled by upconversion contact lenses","https://www.cell.com/cell/fulltext/S0092-8674(25)00454-4","47","30","2025-05-22 22:04:00"
"44065299","27","Kangaroo: A flash cache optimized for tiny objects (2021)","https://engineering.fb.com/2021/10/26/core-infra/kangaroo/","10","0","2025-05-22 22:04:00"
"44065218","28","The Next Abstraction","https://substack.com/inbox/post/164096497","12","0","2025-05-22 22:04:00"
"44026364","29","Four years of sight reading practice","https://sandrock.co.za/carl/2025/05/four-years-of-sight-reading-pracice/","126","64","2025-05-22 22:04:00"
"44064057","30","Show HN: DockFlow – Switch between multiple macOS Dock layouts instantly","https://dockflow.appitstudio.com/","47","33","2025-05-22 22:04:00"
