"id","rank","title","url","points","comments","scrape-date"
"44071900","1","Remembering Alasdair MacIntyre","https://www.wordonfire.org/articles/remembering-alasdair-macintyre-1929-2025/","69","20","2025-05-23 14:36:58"
"44073185","2","Caesar's Last Breath","https://charliesabino.com/caesars-last-breath/","6","0","2025-05-23 14:36:58"
"44070042","3","John Carmack talk at Upper Bound 2025","https://twitter.com/ID_AA_Carmack/status/1925710474366034326","313","183","2025-05-23 14:36:58"
"44050465","4","The Curious Case of the Pygmy Nuthatch","https://slate.com/culture/2025/05/birds-movies-charlies-angels-2000-pygmy-nuthatch.html","56","7","2025-05-23 14:36:58"
"44049926","5","Satellites Spotting Depth","https://tech.marksblogg.com/depth-anything-v2-maxar-ai-detection.html","59","13","2025-05-23 14:36:58"
"44027471","6","Tallest Wooden Wind Turbine","https://modvion.com/","102","81","2025-05-23 14:36:58"
"44071610","7","Writing A Job Runner (In Elixir) (Again) (10 years later)","https://github.com/notactuallytreyanastasio/genstage_tutorial_2025/blob/main/README.md","25","6","2025-05-23 14:36:58"
"44070532","8","KumoRFM: A Foundation Model for In-Context Learning on Relational Data","https://kumo.ai/company/news/kumo-relational-foundation-model/","71","9","2025-05-23 14:36:58"
"44067409","9","Show HN: Defuddle, an HTML-to-Markdown alternative to Readability","https://github.com/kepano/defuddle","334","53","2025-05-23 14:36:58"
"44031082","10","'Turbocharged' Mitochondria Power Birds' Epic Migratory Journeys","https://www.quantamagazine.org/turbocharged-mitochondria-power-birds-epic-migratory-journeys-20250519/","42","9","2025-05-23 14:36:58"
"44045617","11","Quantum Picturalism","https://quantuminpictures.org/","28","3","2025-05-23 14:36:58"
"44072922","12","Amdash – Human only punctuation mark","https://www.theamdash.com","30","20","2025-05-23 14:36:58"
"44063248","13","That fractal that's been up on my wall for years","https://chriskw.xyz/2025/05/21/Fractal/","488","34","2025-05-23 14:36:58"
"44063703","14","Claude 4","https://www.anthropic.com/news/claude-4","1856","1059","2025-05-23 14:36:58"
"44048574","15","Sugar-Coated Poison: Benign Generation Unlocks LLM Jailbreaking","https://arxiv.org/abs/2504.05652","9","3","2025-05-23 14:36:58"
"44065458","16","Does Earth have two high-tide bulges on opposite sides? (2014)","http://physics.stackexchange.com/questions/121830/does-earth-really-have-two-high-tide-bulges-on-opposite-sides","248","73","2025-05-23 14:36:58"
"44071418","17","OpenAI: Scaling PostgreSQL to the Next Level","https://www.pixelstech.net/article/1747708863-openai%3a-scaling-postgresql-to-the-next-level","119","57","2025-05-23 14:36:58"
"44063662","18","Mozilla to shut down Pocket and Fakespot","https://support.mozilla.org/en-US/kb/future-of-pocket","1056","650","2025-05-23 14:36:58"
"44036208","19","A Formal Mathematical Investigation on the Validity of Kellogg's Glaze Claims","https://old.reddit.com/r/theydidthemath/comments/1iljmig/_/","52","11","2025-05-23 14:36:58"
"44068197","20","32 bits that changed microprocessor design","https://spectrum.ieee.org/bellmac-32-ieee-milestone","110","31","2025-05-23 14:36:58"
"44068204","21","Sketchy Calendar","https://www.inkandswitch.com/ink/notes/sketchy-calendar/","110","26","2025-05-23 14:36:58"
"44062160","22","Fast Allocations in Ruby 3.5","https://railsatscale.com/2025-05-21-fast-allocations-in-ruby-3-5/","237","59","2025-05-23 14:36:58"
"44065094","23","How to cheat at settlers by loading the dice (2017)","https://izbicki.me/blog/how-to-cheat-at-settlers-of-catan-by-loading-the-dice-and-prove-it-with-p-values.html","129","102","2025-05-23 14:36:58"
"44064230","24","We’ll be ending web hosting for your apps on Glitch","https://blog.glitch.com/post/changes-are-coming-to-glitch/","151","92","2025-05-23 14:36:58"
"44060156","25","Ancient law requires a bale of straw to hang from Charing Cross rail bridge","https://www.ianvisits.co.uk/articles/ancient-law-requires-a-bale-of-hay-to-hang-from-charing-cross-rail-bridge-81318/","111","120","2025-05-23 14:36:58"
"44050269","26","A South Korean grand master on the art of the perfect soy sauce","https://www.theguardian.com/world/2025/may/21/without-time-there-is-no-flavour-a-south-korean-grand-master-on-the-art-of-the-perfect-soy-sauce","192","148","2025-05-23 14:36:58"
"44061160","27","Improving performance of rav1d video decoder","https://ohadravid.github.io/posts/2025-05-rav1d-faster/","284","99","2025-05-23 14:36:58"
"44062227","28","I Built My Own Audio Player","https://nexo.sh/posts/why-i-built-a-native-mp3-player-in-swiftui/","245","150","2025-05-23 14:36:58"
"44033606","29","Richard Garwin’s role in designing the hydrogen bomb was obscured","https://www.nytimes.com/2025/05/19/science/richard-garwin-hydrogen-bomb.html","68","27","2025-05-23 14:36:58"
"44026516","30","When a team is too big","https://blog.alexewerlof.com/p/when-a-team-is-too-big","106","114","2025-05-23 14:36:58"
