"id","rank","title","url","points","comments","scrape-date"
"44026799","1","Show HN: Goboscript, text-based programming language, compiles to Scratch","https://github.com/aspizu/goboscript","98","26","2025-05-19 10:22:57"
"44020832","2","InventWood is about to mass-produce wood that's stronger than steel","https://techcrunch.com/2025/05/12/inventwood-is-about-to-mass-produce-wood-thats-stronger-than-steel/","111","102","2025-05-19 10:22:57"
"44027867","3","Show HN: Every side project I've built since 2009","https://naeemnur.com/side-projects/","19","1","2025-05-19 10:22:57"
"44027722","4","Seagate claims spinning disks beat SSDs on carbon footprint","https://blocksandfiles.com/2025/04/16/seagate-decarbonizing-data-report/","13","13","2025-05-19 10:22:57"
"44012283","5","`This Printer company served you malware for months, called them false positives","https://www.neowin.net/news/this-printer-company-served-you-malware-for-months-and-dismissed-it-as-false-positives/","92","38","2025-05-19 10:22:57"
"43995067","6","New research reveals the strongest solar event ever detected, in 12350 BC","https://phys.org/news/2025-05-reveals-strongest-solar-event-bc.html","180","85","2025-05-19 10:22:57"
"44027379","7","What does the end of mathematics look like?","https://www.awanderingmind.blog/posts/2025-05-18-what-does-the-end-of-mathematics-look-like.html","25","25","2025-05-19 10:22:57"
"44020591","8","Spaced repetition systems have gotten better","https://domenic.me/fsrs/","883","462","2025-05-19 10:22:57"
"44027768","9","Emulator Debugging: Area 5150's Lake Effect","https://martypc.blogspot.com/2025/05/emulator-debugging-area-5150s-lake.html","5","0","2025-05-19 10:22:57"
"44025439","10","“There are people who can see and others who cannot even look”","https://worldhistory.substack.com/p/there-are-people-who-can-see-and","140","25","2025-05-19 10:22:57"
"44023634","11","Show HN: Sshsync – CLI tool to run shell commands across multiple remote servers","https://github.com/Blackmamoth/sshsync","19","24","2025-05-19 10:22:57"
"44022448","12","Ditching Obsidian and building my own","https://amberwilliams.io/blogs/building-my-own-pkms","346","387","2025-05-19 10:22:57"
"43993311","13","Llama from scratch (2023)","https://blog.briankitano.com/llama-from-scratch/","41","0","2025-05-19 10:22:57"
"44022353","14","Show HN: I modeled the Voynich Manuscript with SBERT to test for structure","https://github.com/brianmg/voynich-nlp-analysis","341","102","2025-05-19 10:22:57"
"44026170","15","Layers All the Way Down: The Untold Story of Shader Compilation","https://moonside.games/posts/layers-all-the-way-down/","63","28","2025-05-19 10:22:57"
"44025484","16","Show HN: Job board aggregator for best paying remote SWE jobs in the U.S.","https://www.remoteswe.fyi","62","42","2025-05-19 10:22:57"
"44024759","17","France Endorses UN Open Source Principles","https://social.numerique.gouv.fr/@codegouvfr/114529954373492878","469","136","2025-05-19 10:22:57"
"44010096","18","Font Activations: A Note on the Type","https://robhorning.substack.com/p/font-activations","37","0","2025-05-19 10:22:57"
"44022758","19","$30 Homebrew Automated Blinds Opener","https://sifter.org/~simon/journal/20240718.html","261","117","2025-05-19 10:22:57"
"44012418","20","Programming in Martin-Lof's Type Theory: An Introduction (1990)","https://www.cse.chalmers.se/research/group/logic/book/","15","0","2025-05-19 10:22:57"
"44022225","21","Spaced Repetition Memory System","https://notes.andymatuschak.org/Spaced_repetition_memory_system","226","26","2025-05-19 10:22:57"
"43998858","22","Charles Butler's the Feminine Monarchie, or the History of Bees (1634 Edition)","https://publicdomainreview.org/collection/history-of-bees/","3","0","2025-05-19 10:22:57"
"44022215","23","What do wealthy people buy, that ordinary people know nothing about? (2015)","https://old.reddit.com/r/AskReddit/comments/2s9u0s/comment/cnnmca8/","186","300","2025-05-19 10:22:57"
"44010684","24","The Connoisseur of Desire","https://www.nybooks.com/articles/2025/05/29/the-connoisseur-of-desire-the-annotated-great-gatsby/","23","0","2025-05-19 10:22:57"
"44023680","25","K-Scale Labs: Open-source humanoid robots, built for developers","https://www.kscale.dev/","101","45","2025-05-19 10:22:57"
"44005692","26","Show HN: A platform to find tech conferences, discounts, and ticket giveaways","https://www.tech.tickets/","75","21","2025-05-19 10:22:57"
"44024173","27","Hyper Typing","https://pscanf.com/s/341/","85","59","2025-05-19 10:22:57"
"44023144","28","Show HN: Vaev – A browser engine built from scratch (It renders google.com)","https://github.com/skift-org/vaev","195","113","2025-05-19 10:22:57"
"44024055","29","Show HN: Python Simulator of David Deutsch’s “Constructor Theory of Time”","https://github.com/gvelesandro/constructor-theory-simulator","75","10","2025-05-19 10:22:57"
"44009185","30","Comparing Parallel Functional Array Languages: Programming and Performance","https://arxiv.org/abs/2505.08906","80","14","2025-05-19 10:22:57"
