"id","rank","title","url","points","comments","scrape-date"
"44026799","1","Show HN: Goboscript, text-based programming language, compiles to Scratch","https://github.com/aspizu/goboscript","32","5","2025-05-19 06:52:50"
"43995067","2","New research reveals the strongest solar event ever detected, in 12350 BC","https://phys.org/news/2025-05-reveals-strongest-solar-event-bc.html","145","71","2025-05-19 06:52:50"
"44026201","3","The principles of database design, or, the Truth is out there","https://ebellani.github.io/blog/2025/the-principles-of-database-design-or-the-truth-is-out-there/","47","37","2025-05-19 06:52:50"
"44020591","4","Spaced repetition systems have gotten better","https://domenic.me/fsrs/","826","441","2025-05-19 06:52:50"
"44025439","5","“There are people who can see and others who cannot even look”","https://worldhistory.substack.com/p/there-are-people-who-can-see-and","103","14","2025-05-19 06:52:50"
"44022448","6","Ditching Obsidian and building my own","https://amberwilliams.io/blogs/building-my-own-pkms","311","325","2025-05-19 06:52:50"
"44026170","7","Layers All the Way Down: The Untold Story of Shader Compilation","https://moonside.games/posts/layers-all-the-way-down/","33","10","2025-05-19 06:52:50"
"44022353","8","Show HN: I modeled the Voynich Manuscript with SBERT to test for structure","https://github.com/brianmg/voynich-nlp-analysis","320","97","2025-05-19 06:52:50"
"44010096","9","Font Activations: A Note on the Type","https://robhorning.substack.com/p/font-activations","25","0","2025-05-19 06:52:50"
"43993311","10","Llama from scratch (2023)","https://blog.briankitano.com/llama-from-scratch/","9","0","2025-05-19 06:52:50"
"44025484","11","Show HN: Job board aggregator for best paying remote SWE jobs in the U.S.","https://www.remoteswe.fyi","38","22","2025-05-19 06:52:50"
"44024759","12","France Endorses UN Open Source Principles","https://social.numerique.gouv.fr/@codegouvfr/114529954373492878","379","84","2025-05-19 06:52:50"
"44022758","13","$30 Homebrew Automated Blinds Opener","https://sifter.org/~simon/journal/20240718.html","240","103","2025-05-19 06:52:50"
"44022225","14","Spaced Repetition Memory System","https://notes.andymatuschak.org/Spaced_repetition_memory_system","210","19","2025-05-19 06:52:50"
"44010684","15","The Connoisseur of Desire","https://www.nybooks.com/articles/2025/05/29/the-connoisseur-of-desire-the-annotated-great-gatsby/","16","0","2025-05-19 06:52:50"
"44023144","16","Show HN: Vaev – A browser engine built from scratch (It renders google.com)","https://github.com/skift-org/vaev","170","93","2025-05-19 06:52:50"
"44005692","17","Show HN: A platform to find tech conferences, discounts, and ticket giveaways","https://www.tech.tickets/","62","21","2025-05-19 06:52:50"
"44024173","18","Hyper Typing","https://pscanf.com/s/341/","74","55","2025-05-19 06:52:50"
"44023680","19","K-Scale Labs: Open-source humanoid robots, built for developers","https://www.kscale.dev/","84","41","2025-05-19 06:52:50"
"43996770","20","The Tongue Is a Fire","https://www.lrb.co.uk/the-paper/v47/n09/ferdinand-mount/the-tongue-is-a-fire","17","5","2025-05-19 06:52:50"
"44009185","21","Comparing Parallel Functional Array Languages: Programming and Performance","https://arxiv.org/abs/2505.08906","68","11","2025-05-19 06:52:50"
"44024055","22","Show HN: Python Simulator of David Deutsch’s “Constructor Theory of Time”","https://github.com/gvelesandro/constructor-theory-simulator","65","7","2025-05-19 06:52:50"
"44023423","23","The Fall of Roam (2022)","https://every.to/superorganizers/the-fall-of-roam","110","58","2025-05-19 06:52:50"
"44022215","24","What do wealthy people buy, that ordinary people know nothing about? (2015)","https://old.reddit.com/r/AskReddit/comments/2s9u0s/comment/cnnmca8/","123","167","2025-05-19 06:52:50"
"44012538","25","Publisher: The Malloy Semantic Model Server","https://github.com/malloydata/publisher","16","0","2025-05-19 06:52:50"
"43999897","26","In Memoriam: John L. Young, Cryptome Co-Founder","https://www.eff.org/deeplinks/2025/05/memoriam-john-l-young-cryptome-co-founder","193","23","2025-05-19 06:52:50"
"44016037","27","Mystical","https://suberic.net/~dmm/projects/mystical/README.html","389","44","2025-05-19 06:52:50"
"44022484","28","Emergent social conventions and collective bias in LLM populations","https://www.science.org/doi/10.1126/sciadv.adu9368","62","18","2025-05-19 06:52:50"
"44022265","29","Show HN: Buckaroo – Data table UI for Notebooks","https://github.com/paddymul/buckaroo","92","8","2025-05-19 06:52:50"
"44020734","30","Show HN: Hardtime.nvim – break bad habits and master Vim motions","https://github.com/m4xshen/hardtime.nvim","184","73","2025-05-19 06:52:50"
