"id","rank","title","url","points","comments","scrape-date"
"48753715","1","ZCode – Harness for GLM-5.2","https://zcode.z.ai/en","204","212","2026-07-02 02:08:46"
"48752905","2","Show HN: Searchable directory of 22k+ products from worker-owned co-ops","https://www.workerowned.info/","223","36","2026-07-02 02:08:46"
"48747304","3","For first time, a cell built from scratch grows and divides","https://www.quantamagazine.org/for-the-first-time-a-cell-built-from-scratch-grows-and-divides-20260701/","734","253","2026-07-02 02:08:46"
"48755005","4","Building an Open-Source Robot Vacuum – Meet Oomwoo","https://makerspet.com/blog/building-an-open-source-robot-vacuum-meet-oomwoo/","30","1","2026-07-02 02:08:46"
"48750710","5","What to learn to be a graphics programmer","https://blog.demofox.org/2026/07/01/what-to-learn-to-be-a-graphics-programmer/","247","129","2026-07-02 02:08:46"
"48754963","6","Global review confirms mRNA vaccines are safe, effective and full of promise ","https://news.ubc.ca/2026/06/mrna-vaccines-are-safe-effective-and-full-of-promise/","80","46","2026-07-02 02:08:46"
"48753979","7","Opening up 'Zero-Knowledge Proof' technology to promote privacy in age assurance","https://blog.google/innovation-and-ai/technology/safety-security/opening-up-zero-knowledge-proof-technology-to-promote-privacy-in-age-assurance/","58","36","2026-07-02 02:08:46"
"48754080","8","The Underhanded C Contest","https://underhanded-c.org/","36","5","2026-07-02 02:08:46"
"48754700","9","The <Usermedia> HTML Element","https://developer.chrome.com/blog/usermedia-html-element","32","14","2026-07-02 02:08:46"
"48745456","10","Physical disc production ending in Jan 2028 for new games on PlayStation","https://blog.playstation.com/2026/07/01/physical-disc-production-ending-in-january-2028-for-new-games-releasing-on-playstation-consoles/","604","630","2026-07-02 02:08:46"
"48754713","11","Meta caps internal AI token spending","https://mlq.ai/news/meta-caps-internal-ai-token-spending-after-costs-approach-billions-in-2026/","114","90","2026-07-02 02:08:46"
"48747116","12","FFmpeg 9.1's new AAC encoder","https://hydrogenaudio.org/index.php/topic,129691.0.html","285","97","2026-07-02 02:08:46"
"48753524","13","Chip Off the Old Block","https://www.astralcodexten.com/p/chip-off-the-old-block","46","5","2026-07-02 02:08:46"
"48753069","14","Qualcomm Linux 2.0","https://www.qualcomm.com/developer/blog/2026/06/qualcomm-linux-2-now-available","50","12","2026-07-02 02:08:46"
"48711565","15","Visual Basic on the PC with Windows 3.1","https://stonetools.ghost.io/visualbasic-win31/","11","5","2026-07-02 02:08:46"
"48753045","16","Proliferate (YC S25) Is Hiring","https://www.ycombinator.com/companies/proliferate/jobs/mMHvKR9-founding-product-engineer","0","0","2026-07-02 02:08:46"
"48745445","17","Box3D, an open source 3D physics engine","https://box2d.org/posts/2026/06/announcing-box3d/","417","92","2026-07-02 02:08:46"
"48732860","18","How do wombats poop cubes? Scientists get to the bottom of the mystery","https://www.science.org/content/article/how-do-wombats-poop-cubes-scientists-get-bottom-mystery","41","7","2026-07-02 02:08:46"
"48746076","19","Internal Combustion Engine (2021)","https://ciechanow.ski/internal-combustion-engine/","286","74","2026-07-02 02:08:46"
"48747976","20","Ask HN: Who is hiring? (July 2026)","https://news.ycombinator.com/item?id=48747976","164","175","2026-07-02 02:08:46"
"48746914","21","Monetization Gateway: Charge for any resource behind Cloudflare via x402","https://blog.cloudflare.com/monetization-gateway/","250","167","2026-07-02 02:08:46"
"48754155","22","Healthy but sedentary people show early decline in cellular energy production","https://news.cuanschutz.edu/news-stories/healthy-but-sedentary-individuals-show-early-decline-in-cellular-energy-production","59","48","2026-07-02 02:08:46"
"48723102","23","The Apple Disk II Controller Card","https://www.bigmessowires.com/2021/11/12/the-amazing-disk-ii-controller-card/","48","11","2026-07-02 02:08:46"
"48748518","24","How We Made IPFS Content Publishing 10x Faster","https://probelab.io/blog/optimistic-provide/","148","48","2026-07-02 02:08:46"
"48746752","25","Launch HN: Parsewise (YC P25) – Reason Across Documents with an API","https://news.ycombinator.com/item?id=48746752","45","45","2026-07-02 02:08:46"
"48709760","26","Flavor Graveyard","https://www.benjerry.com/flavors/flavor-graveyard","25","12","2026-07-02 02:08:46"
"48750989","27","Weave Robotics launches Isaac 1, a $7,999 home robot with Fall 2026 deliveries","https://www.weaverobotics.com/isaac-1","80","126","2026-07-02 02:08:46"
"48753220","28","I Left Harry's All-Night Hamburgers","https://escapepod.org/2013/09/14/ep413-why-i-left-harrys-all-night-hamburgers/","75","10","2026-07-02 02:08:46"
"48755206","29","Fable 5 update: Still willing to cybercrime","https://alec.is/posts/fable-5-update-still-willing-to-cybercrime/","4","0","2026-07-02 02:08:46"
"48752030","30","Fable 5 Is Back","https://twitter.com/claudeai/status/2072402636813607381","323","304","2026-07-02 02:08:46"
