"id","rank","title","url","points","comments","scrape-date"
"46609630","1","A 40-line fix eliminated a 400x performance gap","https://questdb.com/blog/jvm-current-thread-user-time/","113","25","2026-01-14 02:06:23"
"46602591","2","Every GitHub object has two IDs","https://www.greptile.com/blog/github-ids","94","15","2026-01-14 02:06:23"
"46602737","3","vLLM large scale serving: DeepSeek 2.2k tok/s/h200 with wide-ep","https://blog.vllm.ai/2025/12/17/large-scale-serving.html","26","0","2026-01-14 02:06:23"
"46605332","4","The truth behind the 2026 J.P. Morgan Healthcare Conference","https://www.owlposting.com/p/the-truth-behind-the-2026-jp-morgan","33","9","2026-01-14 02:06:23"
"46603111","5","Are two heads better than one?","https://eieio.games/blog/two-heads-arent-better-than-one/","112","25","2026-01-14 02:06:23"
"46603995","6","The Tulip Creative Computer","https://github.com/shorepine/tulipcc","187","38","2026-01-14 02:06:23"
"46605490","7","AI Generated Music Barred from Bandcamp","https://old.reddit.com/r/BandCamp/comments/1qbw8ba/ai_generated_music_on_bandcamp/","577","436","2026-01-14 02:06:23"
"46610967","8","Sei (YC W22) Is Hiring a DevOps Engineer (India/In-Office/Chennai/Gurgaon)","https://www.ycombinator.com/companies/sei/jobs/Rn0KPXR-devops-platform-ai-infrastructure-engineer","0","0","2026-01-14 02:06:23"
"46605854","9","No management needed: anti-patterns in early-stage engineering teams","https://www.ablg.io/blog/no-management-needed","77","121","2026-01-14 02:06:23"
"46609492","10","When hardware goes end-of-life, companies need to open-source the software","https://www.marcia.no/words/eol","162","40","2026-01-14 02:06:23"
"46534632","11","Japan's Skyscraper Factories (2021)","https://www.construction-physics.com/p/japans-skyscraper-factories","39","1","2026-01-14 02:06:23"
"46608840","12","We can't have nice things because of AI scrapers","https://blog.metabrainz.org/2025/12/11/we-cant-have-nice-things-because-of-ai-scrapers/","267","151","2026-01-14 02:06:23"
"46604067","13","Show HN: Microwave – Native iOS app for videos on ATproto","https://testflight.apple.com/join/cVxV1W3g","10","1","2026-01-14 02:06:23"
"46610557","14","The $LANG Programming Language","https://news.ycombinator.com/item?id=46610557","67","9","2026-01-14 02:06:23"
"46604250","15","How to make a damn website (2024)","https://lmnt.me/blog/how-to-make-a-damn-website.html","141","48","2026-01-14 02:06:23"
"46605675","16","Show HN: Nogic – VS Code extension that visualizes your codebase as a graph","https://marketplace.visualstudio.com/items?itemName=Nogic.nogic","69","25","2026-01-14 02:06:23"
"46602102","17","Scott Adams has died","https://www.youtube.com/watch?v=Rs_JrOIo3SE","752","1236","2026-01-14 02:06:23"
"46608811","18","Is it a joke?","https://novalis.org/blog/2025-11-06-is-it-a-joke.html","19","3","2026-01-14 02:06:23"
"46533315","19","My first paper: A practical implementation of Rubiks cube based passkeys","https://ieeexplore.ieee.org/document/11280260","44","17","2026-01-14 02:06:23"
"46595393","20","A deep dive on agent sandboxes","https://pierce.dev/notes/a-deep-dive-on-agent-sandboxes","30","9","2026-01-14 02:06:23"
"46605950","21","A university got itself banned from the Linux kernel (2021)","https://www.theverge.com/2021/4/30/22410164/linux-kernel-university-of-minnesota-banned-open-source","61","41","2026-01-14 02:06:23"
"46609389","22","Show HN: AsciiSketch a free browser-based ASCII art and diagram editor","https://files.littlebird.com.au/ascii-sketch.html","16","4","2026-01-14 02:06:23"
"46605587","23","Let's be honest, Generative AI isn't going all that well","https://garymarcus.substack.com/p/lets-be-honest-generative-ai-isnt","114","122","2026-01-14 02:06:23"
"46555297","24","Inlining – The Ultimate Optimisation","https://xania.org/202512/17-inlining-the-ultimate-optimisation","45","18","2026-01-14 02:06:23"
"46609591","25","The insecure evangelism of LLM maximalists","https://lewiscampbell.tech/blog/260114.html","183","174","2026-01-14 02:06:23"
"46608971","26","Terra - A rolling-release Fedora repository","https://terra.fyralabs.com/","11","4","2026-01-14 02:06:23"
"46604200","27","Revup: Upload once to create multiple, relative GitHub PRs","https://github.com/Skydio/revup","7","2","2026-01-14 02:06:23"
"46603535","28","Influencers and OnlyFans models are dominating U.S. O-1 visa requests","https://www.theguardian.com/us-news/2026/jan/11/onlyfans-influencers-us-o-1-visa","347","248","2026-01-14 02:06:23"
"46600839","29","Confer – End to end encrypted AI chat","https://confer.to/","69","58","2026-01-14 02:06:23"
"46599807","30","Ask HN: Quantum Computation, Computers and Programming","https://news.ycombinator.com/item?id=46599807","18","11","2026-01-14 02:06:23"
