"id","rank","title","url","points","comments","scrape-date"
"44020591","1","Spaced repetition systems have gotten way better","https://domenic.me/fsrs/","320","223","2025-05-18 16:22:54"
"44022353","2","Show HN: I modeled the Voynich Manuscript with SBERT to test for structure","https://github.com/brianmg/voynich-nlp-analysis","13","0","2025-05-18 16:22:54"
"44020734","3","Show HN: Hardtime.nvim – break bad habits and master Vim motions","https://github.com/m4xshen/hardtime.nvim","84","28","2025-05-18 16:22:54"
"43999897","4","In Memoriam: John L. Young, Cryptome Co-Founder","https://www.eff.org/deeplinks/2025/05/memoriam-john-l-young-cryptome-co-founder","80","4","2025-05-18 16:22:54"
"44020626","5","Show HN: A web browser agent in your Chrome side panel","https://github.com/parsaghaffari/browserbee","70","40","2025-05-18 16:22:54"
"44020914","6","Working with Git Patches in Apple Mail (2023)","https://btxx.org/posts/mail/","27","8","2025-05-18 16:22:54"
"43985513","7","Coding without a laptop: Two weeks with AR glasses and Linux on Android","https://holdtherobot.com/blog/2025/05/11/linux-on-android-with-ar-glasses/","864","322","2025-05-18 16:22:54"
"43994490","8","Measure EEG with Arduino","https://www.instructables.com/Measure-EEG-With-ARduino/","8","1","2025-05-18 16:22:54"
"43991185","9","Magic Leap One Bootloader Exploit","https://github.com/EliseZeroTwo/ml1hax","18","1","2025-05-18 16:22:54"
"44020574","10","The Conquest of Hell Gate [pdf]","https://www.nan.usace.army.mil/portals/37/docs/history/hellgate.pdf","38","3","2025-05-18 16:22:54"
"44022233","11","Pluto Flyover from New Horizons","https://apod.nasa.gov/apod/ap250518.html","13","2","2025-05-18 16:22:54"
"44017913","12","AniSora: Open-source anime video generation model","https://komiko.app/video/AniSora","294","146","2025-05-18 16:22:54"
"44022136","13","Solar grants held hostage in Pennsylvania legislature – as demand soars","https://capitalandmain.com/solar-grants-held-hostage-in-pennsylvania-legislature-as-demand-soars","13","4","2025-05-18 16:22:54"
"44020315","14","Paper Mechanisms","https://cutfoldtemplates.com","35","1","2025-05-18 16:22:54"
"43993707","15","Project Verona: Fearless Concurrency for Python","https://microsoft.github.io/verona/pyrona.html","132","93","2025-05-18 16:22:54"
"44021792","16","Apple Card Disabled My iCloud, App Store, and Apple ID Accounts","https://dcurt.is/apple-card-can-disable-your-icloud-account","65","31","2025-05-18 16:22:54"
"44020975","17","How the Sun Enterprise 10000 was born (2007)","https://www.filibeto.org/aduritz/truetrue/e10000/how-e10k-wasborn.html","40","28","2025-05-18 16:22:54"
"43991221","18","Lessons from Mixing Rust and Java: Fast, Safe, and Practical","https://medium.com/@greptime/how-to-supercharge-your-java-project-with-rust-a-practical-guide-to-jni-integration-with-a-86f60e9708b8","95","24","2025-05-18 16:22:54"
"43988975","19","High Available Mosquitto MQTT on Kubernetes","https://raymii.org/s/tutorials/High_Available_Mosquitto_MQTT_Broker_on_Kubernetes.html","27","13","2025-05-18 16:22:54"
"43994190","20","What Every Programmer Should Know About Enumerative Combinatorics","https://leetarxiv.substack.com/p/counting-integer-compositions","58","30","2025-05-18 16:22:54"
"44016037","21","Mystical","https://suberic.net/~dmm/projects/mystical/README.html","310","38","2025-05-18 16:22:54"
"44018301","22","Experts have it easy (2024)","https://boydkane.com/essays/experts","160","75","2025-05-18 16:22:54"
"43987367","23","Show HN: Turn any workflow diagram into compilable, running and stateful code","https://workflows.diagrid.io/","82","18","2025-05-18 16:22:54"
"44020469","24","State of the Art PFAS [pdf]","https://iplo.nl/publish/pages/235260/state-of-the-art-pfas.pdf","16","2","2025-05-18 16:22:54"
"44018886","25","Show HN: Chat with 19 years of HN","https://app.camelai.com/log-in?next=/hn/","61","36","2025-05-18 16:22:54"
"44015144","26","If nothing is curated, how do we find things","https://tadaima.bearblog.dev/if-nothing-is-curated-how-do-we-find-things/","295","210","2025-05-18 16:22:54"
"44015367","27","How to have the browser pick a contrasting color in CSS","https://webkit.org/blog/16929/contrast-color/","235","68","2025-05-18 16:22:54"
"44015872","28","Dead Stars Don’t Radiate","https://johncarlosbaez.wordpress.com/2025/05/17/dead-stars-dont-radiate-and-shrink/","231","118","2025-05-18 16:22:54"
"44014587","29","Palette lighting tricks on the Nintendo 64","https://30fps.net/pages/palette-lighting-tricks-n64/","209","47","2025-05-18 16:22:54"
"44022215","30","What do wealthy people buy, that ordinary people know nothing about? (2015)","https://old.reddit.com/r/AskReddit/comments/2s9u0s/comment/cnnmca8/","5","0","2025-05-18 16:22:54"
